{
  "document_type": "quotation",
  "document_version": "1.1",
  "header": {
    "currency": "USD",
    "vessel_name": "XXXX",
    "date": "2025-10-31",
    "imo_no": "XXXXXXX",
    "vessel_type": "Tanker",
    "customer_name": "XXXX",
    "service_port": "Zhapu Port, China",
    "attention": "XXX",
    "wk_offer_no": "RH-2025-00XXXX",
    "your_ref_no": "",
    "quotation_validity": "30 days",
    "po_no": "",
    "pic_of_winkong": "Jessica"
  },
  "table_schema": {
    "columns": [
      {
        "key": "item",
        "label": "Item"
      },
      {
        "key": "description",
        "label": "Description"
      },
      {
        "key": "unit_price",
        "label": "Unit Price"
      },
      {
        "key": "unit",
        "label": "Unit"
      },
      {
        "key": "qty",
        "label": "Q'ty"
      },
      {
        "key": "discount",
        "label": "Discount"
      },
      {
        "key": "amount",
        "label": "Amount"
      }
    ]
  },
  "quotation_options": [
    {
      "option_id": "option_a",
      "title": "Option A Voyage repair",
      "sections": [
        {
          "section_id": "option_a_main",
          "section_type": "service",
          "title": "Voyage repair service",
          "groups": [
            {
              "group_id": "a_group_1",
              "group_no": "1",
              "title": "AE-1 crankshaft trueness checks in place",
              "description": "",
              "lines": [
                {
                  "line_id": "a-1",
                  "item": "1",
                  "line_no": "1",
                  "line_type": "priced",
                  "description": "AE-1 crankshaft trueness checks in place Working time abt 15 hours",
                  "pricing_mode": "unit_price",
                  "unit_price": 3500.0,
                  "unit_price_display": "3,500.00",
                  "unit": "Unit",
                  "qty": 1,
                  "qty_display": "1",
                  "discount": null,
                  "amount": 3500.0,
                  "amount_display": "3,500.00",
                  "currency": "USD",
                  "status": "chargeable",
                  "basis": "Service quotation based on estimated scope and working hours",
                  "conditions": [],
                  "notes": []
                },
                {
                  "line_id": "a-1-note-maker",
                  "item": "",
                  "line_no": "",
                  "line_type": "technical_note",
                  "description": "Maker: ZJMD-Man B&W 7L23/30H",
                  "pricing_mode": "text_only",
                  "unit_price": null,
                  "unit_price_display": "",
                  "unit": "",
                  "qty": null,
                  "qty_display": "",
                  "discount": null,
                  "amount": null,
                  "amount_display": "",
                  "currency": "USD",
                  "status": "chargeable",
                  "basis": "",
                  "conditions": [],
                  "notes": []
                },
                {
                  "line_id": "a-1-note-scope-title",
                  "item": "",
                  "line_no": "",
                  "line_type": "scope_note",
                  "description": "Work scope:",
                  "pricing_mode": "text_only",
                  "unit_price": null,
                  "unit_price_display": "",
                  "unit": "",
                  "qty": null,
                  "qty_display": "",
                  "discount": null,
                  "amount": null,
                  "amount_display": "",
                  "currency": "USD",
                  "status": "chargeable",
                  "basis": "",
                  "conditions": [],
                  "notes": []
                },
                {
                  "line_id": "a-1-note-scope-1",
                  "item": "",
                  "line_no": "",
                  "line_type": "scope_note",
                  "description": "1) Crankshaft defection check",
                  "pricing_mode": "text_only",
                  "unit_price": null,
                  "unit_price_display": "",
                  "unit": "",
                  "qty": null,
                  "qty_display": "",
                  "discount": null,
                  "amount": null,
                  "amount_display": "",
                  "currency": "USD",
                  "status": "chargeable",
                  "basis": "Included in item 1 scope",
                  "conditions": [],
                  "notes": []
                },
                {
                  "line_id": "a-1-note-scope-2",
                  "item": "",
                  "line_no": "",
                  "line_type": "scope_note",
                  "description": "2) 2pcs M/B lower bearing remove, bearing shell condition check, and crankshaft run-out check by magnetic gauge",
                  "pricing_mode": "text_only",
                  "unit_price": null,
                  "unit_price_display": "",
                  "unit": "",
                  "qty": null,
                  "qty_display": "",
                  "discount": null,
                  "amount": null,
                  "amount_display": "",
                  "currency": "USD",
                  "status": "chargeable",
                  "basis": "Included in item 1 scope",
                  "conditions": [],
                  "notes": []
                },
                {
                  "line_id": "a-1-note-extra",
                  "item": "",
                  "line_no": "",
                  "line_type": "commercial_note",
                  "description": "Other Repair/Spares if needed to be charged extra",
                  "pricing_mode": "text_only",
                  "unit_price": null,
                  "unit_price_display": "",
                  "unit": "",
                  "qty": null,
                  "qty_display": "",
                  "discount": null,
                  "amount": null,
                  "amount_display": "",
                  "currency": "USD",
                  "status": "extra",
                  "basis": "Additional work/spares outside quoted scope",
                  "conditions": [
                    "Only applicable if additional repair or spare parts are required"
                  ],
                  "notes": []
                }
              ]
            },
            {
              "group_id": "a_group_2",
              "group_no": "2",
              "title": "AE resilient mountings renewal",
              "description": "",
              "lines": [
                {
                  "line_id": "a-2-option1-title",
                  "item": "",
                  "line_no": "",
                  "line_type": "header",
                  "description": "Option1",
                  "pricing_mode": "text_only",
                  "unit_price": null,
                  "unit_price_display": "",
                  "unit": "",
                  "qty": null,
                  "qty_display": "",
                  "discount": null,
                  "amount": null,
                  "amount_display": "",
                  "currency": "USD",
                  "status": "chargeable",
                  "basis": "",
                  "conditions": [],
                  "notes": []
                },
                {
                  "line_id": "a-2",
                  "item": "2",
                  "line_no": "2",
                  "line_type": "priced",
                  "description": "AE resilient mountings renewal Approximately 3 days per unit",
                  "pricing_mode": "unit_price",
                  "unit_price": 2800.0,
                  "unit_price_display": "2,800.00",
                  "unit": "Unit",
                  "qty": 3,
                  "qty_display": "3",
                  "discount": {
                    "type": "percentage",
                    "value": 5,
                    "display": "5%"
                  },
                  "amount": 7980.0,
                  "amount_display": "7,980.00",
                  "currency": "USD",
                  "status": "chargeable",
                  "basis": "Option1 pricing with 5% discount on multi-unit job",
                  "conditions": [],
                  "notes": []
                },
                {
                  "line_id": "a-2-note-1",
                  "item": "",
                  "line_no": "",
                  "line_type": "scope_note",
                  "description": "Spares supply by shipside",
                  "pricing_mode": "text_only",
                  "unit_price": null,
                  "unit_price_display": "",
                  "unit": "",
                  "qty": null,
                  "qty_display": "",
                  "discount": null,
                  "amount": null,
                  "amount_display": "",
                  "currency": "USD",
                  "status": "by_owner",
                  "basis": "Spare parts supplied by vessel side",
                  "conditions": [],
                  "notes": []
                },
                {
                  "line_id": "a-2-note-2",
                  "item": "",
                  "line_no": "",
                  "line_type": "assumption_note",
                  "description": "Approximately 7.5 days if done unit by unit.",
                  "pricing_mode": "text_only",
                  "unit_price": null,
                  "unit_price_display": "",
                  "unit": "",
                  "qty": null,
                  "qty_display": "",
                  "discount": null,
                  "amount": null,
                  "amount_display": "",
                  "currency": "USD",
                  "status": "chargeable",
                  "basis": "Estimated execution duration",